<?xml version="1.0" encoding="UTF-8"?>

<configExamples xmlns:xsi="http://www.w3.org/2001/XMLSchema-instance" xsi:noNamespaceSchemaLocation="xml_components2.xsd">
  <endhost>
  	<host />
  	<packet body="" destination="" email_from="" options="" protocol="HTTP_REQUEST" sequence="0" url=""/>
  </endhost>
  
  <endhost>
  	<webserver> 
  		<name>Webserver</name>
  	</webserver>
  	<packet body="" destination="" email_from="" options="" protocol="HTTP_REQUEST" sequence="0" url=""/>
  </endhost>
  
  <endhost>
  	<webclient webserver="Webserver"/>
  	<packet body="" destination="" email_from="" options="" protocol="HTTP_REQUEST" sequence="0" url=""/>
  </endhost>
  
  <endhost>
  	<webserver> 
  		<name>Mailserver</name>
  	</webserver>
  	<packet body="" destination="" email_from="" options="" protocol="HTTP_REQUEST" sequence="0" url=""/>
  </endhost>
  <endhost>
  	<mailclient mailserver="Mailserver"/>
  	<packet body="" destination="" email_from="" options="" protocol="HTTP_REQUEST" sequence="0" url=""/>
  </endhost>
</configExamples>